{"$schema":"./reference-host-profile.schema.json","approval":{"approvalReference":"https://github.com/OSHEThai/HerdrOps/issues/149#issuecomment-5379418145","approvedBy":"@yutthaphon","approvedOn":"2026-08-22"},"candidatePolicy":{"renderer":{"policy":"software-only-process-wide","wpfProcessRenderMode":"SoftwareOnly"},"sampling":{"durationSeconds":20,"intervalMilliseconds":250,"requiredLanguageMatrix":["Thai","English"]},"workingSetPolicy":{"combinedMaximumBytes":267386880,"combinedMaximumMebibytes":255,"statistic":"maximum"}},"diagnosticPolicy":{"excludedFromEnvironmentBinding":["diagnostics.observedUtc","diagnostics.availablePhysicalMemoryBytes","diagnostics.batteryState","diagnostics.backgroundProcessCount"]},"environmentBinding":{"activeDisplay":{"activeMonitorCount":1,"adapterPnpDeviceId":"PCI\\VEN_8086&DEV_4688&SUBSYS_170F1025&REV_0C\\3&11583659&0&10","desktopAppliedDpi":120,"logicalHeightPixels":1280,"logicalWidthPixels":2048,"monitorInstanceName":"DISPLAY\\AUOF8A7\\4&11e1d6d3&0&UID8388688_0","physicalHeightPixels":1600,"physicalWidthPixels":2560,"primaryDisplayDeviceName":"\\\\.\\DISPLAY1","refreshRateHz":60,"scalePercent":125},"graphicsAdapters":[{"displayName":"Intel(R) UHD Graphics","driverVersion":"31.0.101.4146","pnpDeviceId":"PCI\\VEN_8086&DEV_4688&SUBSYS_170F1025&REV_0C\\3&11583659&0&10"},{"displayName":"NVIDIA GeForce RTX 4050 Laptop GPU","driverVersion":"32.0.16.1088","pnpDeviceId":"PCI\\VEN_10DE&DEV_28E1&SUBSYS_170F1025&REV_A1\\4&2CAD08CE&0&0008"}],"herdr":{"executableSha256":"AFE7BAD9B77946917B509C9B638BB2A47BC1D4F19254957D15B0FAAFBEDB3E93","installPathRelativeToLocalAppData":"Programs\\Herdr\\bin\\herdr.exe","releaseId":"0.8.2-preview.2026-08-19-b5c4a0176e91-x86_64-pc-windows-msvc","version":"0.8.2-preview.2026-08-19-b5c4a0176e91"},"host":{"architecture":"x64","machineName":"SUBMARK-NB","manufacturer":"Acer","model":"Predator PHN16-71","operatingSystemBuild":26220,"operatingSystemCaption":"Microsoft Windows 11 Pro Insider Preview","operatingSystemVersion":"10.0.26220"}},"profileId":"herdrops-v0.2-submark-nb-software-only-20260822","schemaVersion":1}
